{
  "$schema": "https://json-schema.org/draft/2020-12/schema",
  "title": "RFC",
  "type": "object",
  "required": [
    "title",
    "motivation",
    "scope",
    "acceptanceCriteria",
    "risks",
    "milestones"
  ],
  "properties": {
    "title": {
      "type": "string"
    },
    "motivation": {
      "type": "string"
    },
    "scope": {
      "type": "object",
      "required": [
        "in",
        "out"
      ],
      "properties": {
        "in": {
          "type": "array",
          "items": {
            "type": "string"
          }
        },
        "out": {
          "type": "array",
          "items": {
            "type": "string"
          }
        }
      }
    },
    "acceptanceCriteria": {
      "type": "array",
      "items": {
        "type": "string"
      }
    },
    "risks": {
      "type": "array",
      "items": {
        "type": "string"
      }
    },
    "milestones": {
      "type": "array",
      "items": {
        "type": "object",
        "required": [
          "name",
          "eta"
        ],
        "properties": {
          "name": {
            "type": "string"
          },
          "eta": {
            "type": "string"
          }
        }
      }
    },
    "links": {
      "type": "array",
      "items": {
        "type": "string"
      }
    }
  }
}