{
  "title": "樣例：我的課程列表",
  "motivation": "提升學習體驗與日活",
  "scope": {
    "in": [
      "課程列表 API",
      "詳情頁"
    ],
    "out": [
      "推播",
      "付款"
    ]
  },
  "acceptanceCriteria": [
    "登入後可見課程清單",
    "可點選進入詳情頁"
  ],
  "risks": [
    "第三方 API 限流"
  ],
  "milestones": [
    {
      "name": "規格凍結",
      "eta": "2025-11-05"
    }
  ],
  "links": []
}